<jqassistant-plugin xmlns="http://schema.jqassistant.org/plugin/v2.2"
                    xmlns:xsi="http://www.w3.org/2001/XMLSchema-instance"
                    xsi:schemaLocation="http://schema.jqassistant.org/plugin/v2.2 https://schema.jqassistant.org/plugin/jqassistant-plugin-v2.2.xsd"
                    id="jqa.plugin.it"
                    name="jQAssistant Custom Plugin"
                    version="${project.version}">
    <description>Custom plugins.</description>
    <model>
        <class>com.buschmais.jqassistant.scm.maven.integration.plugin.CustomDescriptor</class>
    </model>
    <scanner>
        <class>com.buschmais.jqassistant.scm.maven.integration.plugin.CustomScannerPlugin</class>
    </scanner>
    <report>
        <class id="custom">com.buschmais.jqassistant.scm.maven.integration.plugin.CustomReportPlugin</class>
    </report>
</jqassistant-plugin>
